phrases,tagged_phrases,dummy_labels
that job,that dt job nn,1
that jobwe,that dt jobwe nn,1
that motor,that dt motor nn,1
that mud,that dt mud nn,1
that original converter,that dt original jj converter nn,1
that pi test,that dt pi vbz test nn,1
that pump,that dt pump nn,1
that time,that dt time nn,1
that water,that dt water nn,1
thaw,thaw nn,1
the abnormal,the dt abnormal nn,1
the above,the dt above nn,1
the ac,the dt ac nn,1
the access,the dt access nn,1
the actions,the dt actions nns,1
the active,the dt active jj,1
the acuracy,the dt acuracy nn,1
the adjustment,the dt adjustment nn,1
the admin,the dt admin nn,1
the aft,the dt aft nn,1
the air,the dt air nn,1
the aircure,the dt aircure nn,1
the airflow,the dt airflow nn,1
the alarm,the dt alarm nn,1
the aluminium,the dt aluminium nn,1
the annual,the dt annual jj,1
the applicable,the dt applicable jj,1
the appropriate,the dt appropriate nn,1
the area,the dt area nn,1
the assembly,the dt assembly nn,1
the assemilation,the dt assemilation nn,1
the assistance,the dt assistance nn,1
the attach,the dt attach nn,1
the attached,the dt attached jj,1
the aux,the dt aux nn,1
the auxiliaries,the dt auxiliaries nns,1
the availability,the dt availability nn,1
the available,the dt available jj,1
the awb,the dt awb nn,1
the b,the dt b nn,1
the back,the dt back nn,1
the bad,the dt bad jj,1
the ball,the dt ball nn,1
the barrier,the dt barrier nn,1
the base,the dt base nn,1
the baylor,the dt baylor nn,1
the bearing,the dt bearing nn,1
the bearings,the dt bearings nns,1
the below,the dt below nn,1
the belt,the dt belt nn,1
the belts,the dt belts nns,1
the bender,the dt bender nn,1
the bladder,the dt bladder nn,1
the blades,the dt blades nns,1
the block,the dt block nn,1
the blower,the dt blower nn,1
the blowers,the dt blowers nns,1
the boat,the dt boat nn,1
the bolt,the dt bolt nn,1
the bolts,the dt bolts nns,1
the bottom,the dt bottom nn,1
the box,the dt box nn,1
the breaker,the dt breaker nn,1
the bucket,the dt bucket nn,1
the bulk,the dt bulk nn,1
the bulletin,the dt bulletin nn,1
the bus,the dt bus nn,1
the busbar,the dt busbar nn,1
the cabinet,the dt cabinet nn,1
the cable,the dt cable nn,1
the cables,the dt cables nns,1
the cabling,the dt cabling nn,1
the cause,the dt cause nn,1
the center,the dt center nn,1
the checks,the dt checks nns,1
the choke,the dt choke nn,1
the circuit,the dt circuit nn,1
the cleanes,the dt cleanes nns,1
the closed,the dt closed jj,1
the cm,the dt cm nn,1
the coiled,the dt coiled jj,1
the combination,the dt combination nn,1
the company,the dt company nn,1
the complete,the dt complete jj,1
the components,the dt components nns,1
the conditions,the dt conditions nns,1
the configuration,the dt configuration nn,1
the connection,the dt connection nn,1
the connections,the dt connections nns,1
the consistent,the dt consistent nn,1
the contactors,the dt contactors nns,1
the control,the dt control nn,1
the cooling,the dt cooling nn,1
the correct,the dt correct nn,1
the corrective,the dt corrective nn,1
the cover,the dt cover nn,1
the covers,the dt covers nns,1
the craft,the dt craft nn,1
the crane,the dt crane nn,1
the crimps,the dt crimps nns,1
the cubicle,the dt cubicle nn,1
the cyber,the dt cyber nn,1
the damage,the dt damage nn,1
the data,the dt data nn,1
the day,the dt day nn,1
the de,the dt de nn,1
the deck,the dt deck nn,1
the defective,the dt defective jj,1
the demister,the dt demister nn,1
the derrick,the dt derrick nn,1
the details,the dt details nns,1
the difference,the dt difference nn,1
the direct,the dt direct jj,1
the dirt,the dt dirt nn,1
the documents,the dt documents nns,1
the door,the dt door nn,1
the draw,the dt draw nn,1
the drawing,the dt drawing nn,1
the drill,the dt drill nn,1
the driller,the dt driller nn,1
the drillfloor,the dt drillfloor nn,1
the drilling,the dt drilling nn,1
the drive,the dt drive nn,1
the drives,the dt drives nns,1
the dsgr,the dt dsgr nn,1
the duct,the dt duct nn,1
the ducting,the dt ducting nn,1
the ducts,the dt ducts nns,1
the eadge,the dt eadge nn,1
the earth,the dt earth nn,1
the electric,the dt electric jj,1
the electrical,the dt electrical jj,1
the elements,the dt elements nns,1
the empellor,the dt empellor nn,1
the encoder,the dt encoder nn,1
the encoders,the dt encoders nns,1
the engineering,the dt engineering nn,1
the engineers,the dt engineers nns,1
the environment,the dt environment nn,1
the equipment,the dt equipment nn,1
the estop,the dt estop nn,1
the ets,the dt ets nns,1
the exceptable,the dt exceptable jj,1
the exception,the dt exception nn,1
the exterior,the dt exterior nn,1
the external,the dt external jj,1
the eyebolt,the dt eyebolt nn,1
the face,the dt face nn,1
the fact,the dt fact nn,1
the fan,the dt fan nn,1
the fault,the dt fault nn,1
the faulty,the dt faulty nn,1
the field,the dt field nn,1
the file,the dt file nn,1
the filter,the dt filter nn,1
the filters,the dt filters nns,1
the final,the dt final jj,1
the first,the dt first jj,1
the fiscal,the dt fiscal jj,1
the flages,the dt flages nns,1
the floor,the dt floor nn,1
the foam,the dt foam nn,1
the following,the dt following nn,1
the foundation,the dt foundation nn,1
the fourth,the dt fourth jj,1
the frame,the dt frame nn,1
the front,the dt front nn,1
the function,the dt function nn,1
the fundation,the dt fundation nn,1
the fuse,the dt fuse nn,1
the future,the dt future nn,1
the gaskets,the dt gaskets nns,1
the gauges,the dt gauges nns,1
the ge,the dt ge nn,1
the gland,the dt gland nn,1
the glands,the dt glands nns,1
the global,the dt global jj,1
the gom,the dt gom nn,1
the good,the dt good jj,1
the ground,the dt ground nn,1
the guages,the dt guages nns,1
the guys,the dt guys nns,1
the handover,the dt handover nn,1
the heat,the dt heat nn,1
the heater,the dt heater nn,1
the heaters,the dt heaters nns,1
the high,the dt high jj,1
the hmi,the dt hmi nn,1
the holes,the dt holes nns,1
the hose,the dt hose nn,1
the hot,the dt hot jj,1
the hour,the dt hour nn,1
the hours,the dt hours nns,1
the housing,the dt housing nn,1
the hp,the dt hp nn,1
the hub,the dt hub nn,1
the ibop,the dt ibop nn,1
the id,the dt id nn,1
the impeller,the dt impeller nn,1
the impellers,the dt impellers nns,1
the impellor,the dt impellor nn,1
the impellors,the dt impellors nns,1
the impller,the dt impller nn,1
the imppler,the dt imppler nn,1
the incorrect,the dt incorrect nn,1
the indicator,the dt indicator nn,1
the initial,the dt initial jj,1
the inlet,the dt inlet nn,1
the inputs,the dt inputs nns,1
the inside,the dt inside nn,1
the inspection,the dt inspection nn,1
the instrumentation,the dt instrumentation nn,1
the insulation,the dt insulation nn,1
the interior,the dt interior nn,1
the internal,the dt internal jj,1
the intrusiveness,the dt intrusiveness nn,1
the ir,the dt ir nn,1
the isolation,the dt isolation nn,1
the issue,the dt issue nn,1
the item,the dt item nn,1
the items,the dt items nns,1
the jbox,the dt jbox nn,1
the jboxes,the dt jboxes nns,1
the job,the dt job nn,1
the junction,the dt junction nn,1
the lack,the dt lack nn,1
the last,the dt last jj,1
the lead,the dt lead nn,1
the leads,the dt leads nns,1
the lift,the dt lift nn,1
the lifting,the dt lifting nn,1
the list,the dt list nn,1
the lo,the dt lo nn,1
the local,the dt local jj,1
the location,the dt location nn,1
the loose,the dt loose jj,1
the louver,the dt louver nn,1
the louvers,the dt louvers nns,1
the louvres,the dt louvres nns,1
the low,the dt low jj,1
the main,the dt main jj,1
the mains,the dt mains nns,1
the maintenance,the dt maintenance nn,1
the manifold,the dt manifold nn,1
the manual,the dt manual jj,1
the manufacturers,the dt manufacturers nns,1
the marcelo,the dt marcelo nn,1
the maximum,the dt maximum nn,1
the mcc,the dt mcc nn,1
the meaurement,the dt meaurement nn,1
the mech,the dt mech nn,1
the mechanic,the dt mechanic nn,1
the mechanical,the dt mechanical jj,1
the mechanics,the dt mechanics nns,1
the megger,the dt megger nn,1
the men,the dt men nns,1
the mge,the dt mge nn,1
the min,the dt min nn,1
the module,the dt module nn,1
the moment,the dt moment nn,1
the moonpool,the dt moonpool nn,1
the motor,the dt motor nn,1
the motors,the dt motors nns,1
the motr,the dt motr nn,1
the mounting,the dt mounting nn,1
the mp,the dt mp nn,1
the mud,the dt mud nn,1
the mudpumps,the dt mudpumps nns,1
the name,the dt name nn,1
the nameplate,the dt nameplate nn,1
the napro,the dt napro nn,1
the nd,the dt nd nn,1
the nde,the dt nde nn,1
the need,the dt need nn,1
the new,the dt new jj,1
the next,the dt next jj,1
the nitrogen,the dt nitrogen nn,1
the noise,the dt noise nn,1
the normal,the dt normal jj,1
the notes,the dt notes nns,1
the nov,the dt nov nn,1
the oem,the dt oem nn,1
the old,the dt old jj,1
the open,the dt open jj,1
the operation,the dt operation nn,1
the opportunity,the dt opportunity nn,1
the options,the dt options nns,1
the original,the dt original jj,1
the other,the dt other jj,1
the others,the dt others nns,1
the outside,the dt outside nn,1
the overhaul,the dt overhaul nn,1
the panel,the dt panel nn,1
the paper,the dt paper nn,1
the part,the dt part nn,1
the parts,the dt parts nns,1
the phases,the dt phases nns,1
the pictures,the dt pictures nns,1
the piping,the dt piping nn,1
the place,the dt place nn,1
the plan,the dt plan nn,1
the plane,the dt plane nn,1
the plate,the dt plate nn,1
the plug,the dt plug nn,1
the plugs,the dt plugs nn,1
the pm,the dt pm nn,1
the pms,the dt pms nn,1
the po,the dt po nn,1
the polarization,the dt polarization nn,1
the pontus,the dt pontus nn,1
the power,the dt power nn,1
the presence,the dt presence nn,1
the pressure,the dt pressure nn,1
the problem,the dt problem nn,1
the proper,the dt proper jj,1
the pulley,the dt pulley nn,1
the pulsation,the dt pulsation nn,1
the pump,the dt pump nn,1
the pumproom,the dt pumproom nn,1
the pumps,the dt pumps nns,1
the purchase,the dt purchase nn,1
the purge,the dt purge nn,1
the questionable,the dt questionable jj,1
the rdco,the dt rdco nn,1
the reading,the dt reading nn,1
the readings,the dt readings nns,1
the rear,the dt rear nn,1
the recient,the dt recient nn,1
the reference,the dt reference nn,1
the referenced,the dt referenced nn,1
the relief,the dt relief nn,1
the remedial,the dt remedial nn,1
the remote,the dt remote nn,1
the removal,the dt removal nn,1
the rental,the dt rental nn,1
the repaired,the dt repaired nn,1
the replacement,the dt replacement nn,1
the report,the dt report nn,1
the requirements,the dt requirements nns,1
the resistance,the dt resistance nn,1
the respective,the dt respective nn,1
the rest,the dt rest nn,1
the restriction,the dt restriction nn,1
the results,the dt results nns,1
the rig,the dt rig nn,1
the right,the dt right nn,1
the rigs,the dt rigs nns,1
the riser,the dt riser nn,1
the risk,the dt risk nn,1
the rms,the dt rms nns,1
the room,the dt room nn,1
the rotary,the dt rotary nn,1
the rtd,the dt rtd nn,1
the rtds,the dt rtds nn,1
the rubber,the dt rubber nn,1
the run,the dt run nn,1
the running,the dt running nn,1
the rust,the dt rust nn,1
the s,the dt s nn,1
the same,the dt same jj,1
the screen,the dt screen nn,1
the seals,the dt seals nns,1
the second,the dt second jj,1
the sensor,the dt sensor nn,1
the shaft,the dt shaft nn,1
the ship,the dt ship nn,1
the shop,the dt shop nn,1
the side,the dt side nn,1
the signal,the dt signal nn,1
the size,the dt size nn,1
the skid,the dt skid nn,1
the software,the dt software nn,1
the space,the dt space nn,1
the spare,the dt spare nn,1
the speed,the dt speed nn,1
the stand,the dt stand nn,1
the standpipe,the dt standpipe nn,1
the stariner,the dt stariner nn,1
the start,the dt start nn,1
the stator,the dt stator nn,1
the steps,the dt steps nns,1
the store,the dt store nn,1
the stroke,the dt stroke nn,1
the strokes,the dt strokes nns,1
the supply,the dt supply nn,1
the surface,the dt surface nn,1
the switch,the dt switch nn,1
the swivels,the dt swivels nns,1
the system,the dt system nn,1
the t,the dt t nn,1
the tag,the dt tag nn,1
the tags,the dt tags nn,1
the tapped,the dt tapped nn,1
the target,the dt target nn,1
the task,the dt task nn,1
the tasks,the dt tasks nns,1
the tco,the dt tco nn,1
the temperature,the dt temperature nn,1
the temperatures,the dt temperatures nns,1
the terminal,the dt terminal nn,1
the terminals,the dt terminals nns,1
the test,the dt test nn,1
the thermometer,the dt thermometer nn,1
the third,the dt third jj,1
the threads,the dt threads nns,1
the thruster,the dt thruster nn,1
the time,the dt time nn,1
the titan,the dt titan nn,1
the toolpusher,the dt toolpusher nn,1
the tools,the dt tools nns,1
the top,the dt top jj,1
the topside,the dt topside nn,1
the torque,the dt torque nn,1
the tray,the dt tray nn,1
the tripped,the dt tripped nn,1
the unit,the dt unit nn,1
the units,the dt units nns,1
the update,the dt update nn,1
the use,the dt use nn,1
the vent,the dt vent nn,1
the vessel,the dt vessel nn,1
the vfd,the dt vfd nn,1
the vfds,the dt vfds nn,1
the vibration,the dt vibration nn,1
the voyage,the dt voyage nn,1
the warm,the dt warm nn,1
the water,the dt water nn,1
the way,the dt way nn,1
the well,the dt well nn,1
the whole,the dt whole nn,1
the winding,the dt winding nn,1
the windings,the dt windings nns,1
the window,the dt window nn,1
the wires,the dt wires nns,1
the wiring,the dt wiring nn,1
the work,the dt work nn,1
the worknotes,the dt worknotes nns,1
the workshop,the dt workshop nn,1
the year,the dt year nn,1
the yearly,the dt yearly jj,1
the yellow,the dt yellow nn,1
the yr,the dt yr nn,1
then compared,then rb compared vbn,1
thermal,thermal nn,1
thermistors,thermistors nns,1
thermometer,thermometer nn,1
these areas,these dt areas nns,1
these belts,these dt belts nns,1
these blowers,these dt blowers nns,1
these checks,these dt checks nns,1
these drives,these dt drives nns,1
these holes,these dt holes nns,1
these levels,these dt levels nns,1
these models,these dt models nns,1
these moto,these dt moto nn,1
these motors,these dt motors nns,1
these parameters,these dt parameters nns,1
these particles,these dt particles nns,1
these parts,these dt parts nns,1
these procedures,these dt procedures nns,1
these pump,these dt pump nn,1
these pumps,these dt pumps nns,1
these readings,these dt readings nns,1
these steps,these dt steps nns,1
these systems,these dt systems nns,1
these task,these dt task nn,1
these tasks,these dt tasks nns,1
these units,these dt units nns,1
these were,these dt were vbd,1
theye,theye nn,1
thick,thick nn,1
thing,thing nn,1
third,third jj,1
this ac,this dt ac nn,1
this alarm,this dt alarm nn,1
this base,this dt base nn,1
this blower,this dt blower nn,1
this bolt,this dt bolt nn,1
this cant,this dt cant nn,1
this cause,this dt cause nn,1
this data,this dt data nn,1
this day,this dt day nn,1
this equipment,this dt equipment nn,1
this event,this dt event nn,1
this i,this dt i nn,1
this inspection,this dt inspection nn,1
this inverter,this dt inverter nn,1
this job,this dt job nn,1
this louver,this dt louver nn,1
this mcc,this dt mcc nn,1
this mecahnics,this dt mecahnics nns,1
this moment,this dt moment nn,1
this motor,this dt motor nn,1
this motors,this dt motors nns,1
this mud,this dt mud nn,1
this number,this dt number nn,1
this parameter,this dt parameter nn,1
this parameters,this dt parameters nns,1
this parts,this dt parts nns,1
this pm,this dt pm nn,1
this point,this dt point nn,1
this project,this dt project nn,1
this proposal,this dt proposal nn,1
this pump,this dt pump nn,1
this remote,this dt remote nn,1
this rig,this dt rig nn,1
this safety,this dt safety nn,1
this satisfactory,this dt satisfactory nn,1
this size,this dt size nn,1
this step,this dt step nn,1
this system,this dt system nn,1
this task,this dt task nn,1
this tasks,this dt tasks nns,1
this time,this dt time nn,1
this timeno,this dt timeno nn,1
this type,this dt type nn,1
this unit,this dt unit nn,1
this value,this dt value nn,1
this vibration,this dt vibration nn,1
this was,this dt was vbd,1
thkness,thkness nn,1
thread,thread nn,1
threaded,threaded vbd,1
threads,threads nns,1
through bolt,through in_pos bolt nn,1
through with inspection,through in_pos with in_pos inspection nn,1
thru,thru nn,1
thru complete,thru nn complete jj,1
thru completed,thru nn completed vbd,1
thruster,thruster nn,1
ti,ti nn,1
ticket,ticket nn,1
ties,ties nns,1
tight,tight nn,1
tighten,tighten nns,1
tightened,tightened vbd,1
tightly mounted,tightly rb mounted vbn,1
tightness,tightness nn,1
time,time nn,1
times,times nns,1
to be accessed,to to_pos be vb accessed vbn,1
to be analyzed,to to_pos be vb analyzed vbn,1
to be carried,to to_pos be vb carried vbn,1
to be changed,to to_pos be vb changed vbn,1
to be checked,to to_pos be vb checked vbn,1
to be cleaned,to to_pos be vb cleaned vbn,1
to be completed,to to_pos be vb completed vbn,1
to be configured,to to_pos be vb configured vbn,1
to be connected,to to_pos be vb connected vbn,1
to be cracked,to to_pos be vb cracked vbn,1
to be cut,to to_pos be vb cut vbn,1
to be done,to to_pos be vb done vbn,1
to be fitted,to to_pos be vb fitted vbn,1
to be greased,to to_pos be vb greased vbn,1
to be inspected,to to_pos be vb inspected vbn,1
to be installed,to to_pos be vb installed vbn,1
to be investigated,to to_pos be vb investigated vbn,1
to be maintained,to to_pos be vb maintained vbn,1
to be perfomed,to to_pos be vb perfomed vbn,1
to be performed,to to_pos be vb performed vbn,1
to be removed,to to_pos be vb removed vbn,1
to be repaired,to to_pos be vb repaired vbn,1
to be replaced,to to_pos be vb replaced vbn,1
to be reported,to to_pos be vb reported vbn,1
to be sent,to to_pos be vb sent vbn,1
to be stored,to to_pos be vb stored vbn,1
to be stripped,to to_pos be vb stripped vbn,1
to be tested,to to_pos be vb tested vbn,1
to be updated,to to_pos be vb updated vbn,1
to deck opened,to to_pos deck vb opened jj,1
to replace damaged,to to_pos replace vb damaged vbn,1
to report confirmed,to to_pos report vb confirmed nns,1
to report consulted,to to_pos report vb consulted vbn,1
to report equipped,to to_pos report vb equipped nns,1
to report made,to to_pos report vb made vbn,1
to stay closed,to to_pos stay vb closed jj,1
to work instructed,to to_pos work vb instructed jj,1
today,today nn,1
tofs,tofs nn,1
together by mi,together rb by in_pos mi nn,1
toi,toi nn,1
toke,toke nn,1
ton,ton nn,1
took,took vbd,1
tool,tool nn,1
toolpusher,toolpusher nn,1
tools,tools nns,1
top,top nn,1
topping,topping vbg,1
torque,torque nn,1
torque megged,torque nn megged vbd,1
torqued,torqued vbn,1
town,town nn,1
tp,tp nn,1
trace,trace nn,1
tracking,tracking vbg,1
transfer,transfer nn,1
transfered,transfered vbn,1
transit,transit nn,1
transmitter,transmitter nn,1
traume,traume nn,1
tray,tray nn,1
trend,trend nn,1
tricks,tricks nns,1
tried,tried vbn,1
trigger,trigger nn,1
tripped,tripped nns,1
tripping,tripping vbg,1
trnasfreed,trnasfreed nn,1
troubleshoot,troubleshoot nn,1
troubleshooting,troubleshooting vbg,1
true,true jj,1
try,try nn,1
trying,trying vbg,1
tthe,tthe nn,1
tubing,tubing vbg,1
tucked,tucked nns,1
turned,turned vbd,1
type,type nn,1
u,u nn,1
unable,unable jj,1
unc,unc nn,1
undamaged,undamaged jj,1
under correct,under in_pos correct nn,1
under hatch,under in_pos hatch nn,1
under michael,under in_pos michael nn,1
under mike,under in_pos mike nn,1
under tag,under in_pos tag nn,1
understanding,understanding vbg,1
unit,unit nn,1
units,units nns,1
until final report,until in_pos final jj report nn,1
unusual,unusual jj,1
unwired,unwired jj,1
up checked,up rb checked vbn,1
up of mud,up in_pos of in_pos mud nn,1
up prevent access,up rb prevent jj access nn,1
up terminal box,up in_pos terminal jj box nn,1
updated,updated vbn,1
uploaded,uploaded jj,1
upon further investigation,upon in_pos further jj investigation nn,1
upon inspection,upon in_pos inspection nn,1
upon reactivation,upon in_pos reactivation nn,1
upon visual inspection,upon in_pos visual jj inspection nn,1
use,use nn,1
used,used vbn,1
using,using vbg,1
v,v nn,1
v dc,v nn dc nn,1
value,value nn,1
values,values nns,1
valves,valves nns,1
varghese,varghese jj,1
various,various jj,1
vbelts,vbelts nns,1
vdc,vdc nn,1
vdcmin,vdcmin nn,1
velasco,velasco nn,1
vendor,vendor nn,1
vendors,vendors nns,1
vent,vent nn,1
ventilation,ventilation nn,1
vents,vents nns,1
verified,verified vbn,1
verify,verify nn,1
verifying,verifying vbg,1
very clean,very rb clean jj,1
very ggod,very rb ggod jj,1
very good,very rb good jj,1
very little,very rb little jj,1
very low,very rb low jj,1
very minimal,very rb minimal jj,1
very similar,very rb similar jj,1
vfd,vfd nn,1
vfds,vfds nn,1
vibarations,vibarations nns,1
vibrating,vibrating vbg,1
vibration,vibration nn,1
vibrations,vibrations nns,1
vibrationthe,vibrationthe nn,1
vincent,vincent nn,1
visable,visable jj,1
visible,visible jj,1
visit,visit nn,1
visual,visual jj,1
visualized,visualized vbn,1
visually checked,visually rb checked vbn,1
visually examine,visually rb examine vb,1
visually examined,visually rb examined vbn,1
visually inspect,visually rb inspect jj,1
visually inspected,visually rb inspected vbn,1
visually observed,visually rb observed vbn,1
visually verified,visually rb verified vbn,1
visualy,visualy nn,1
vlaves,vlaves nns,1
voltage,voltage nn,1
volts,volts nns,1
volume,volume nn,1
vs,vs nn,1
w,w nn,1
waiiting,waiiting vbg,1
wait,wait nn,1
waiting,waiting vbg,1
walk,walk nn,1
warning,warning vbg,1
warrantymarinesgabbcom,warrantymarinesgabbcom nn,1
was,was vbd,1
wash,wash nn,1
washer,washer nn,1
washer flat,washer rb flat jj,1
washers,washers nns,1
wasnt,wasnt nn,1
wasnt done,wasnt nn done vbn,1
watched,watched vbn,1
water,water nn,1
watts,watts nn,1
ways,ways nns,1
wccm,wccm nn,1
wear,wear nn,1
week,week nn,1
weeks,weeks nns,1
weight,weight nn,1
weld,weld nn,1
welded,welded vbd,1
welder,welder nn,1
welding,welding vbg,1
well,well rb,1
well aligned,well rb aligned vbn,1
well bonded,well rb bonded vbn,1
well recommended,well rb recommended jj,1
well tds,well rb tds nn,1
well within range,well rb within in_pos range nn,1
went,went vbd,1
were,were vbd,1
werent,werent nn,1
while ac motor,while in_pos ac nns motor nn,1
while blower,while in_pos blower nn,1
while equipment,while in_pos equipment nn,1
while fan,while in_pos fan nn,1
while isolation,while in_pos isolation nn,1
while motor,while in_pos motor nn,1
while pump,while in_pos pump nn,1
whilst,whilst nn,1
will be carried,will md be vb carried vbn,1
will be changed,will md be vb changed vbn,1
will be checked,will md be vb checked vbn,1
will be closed,will md be vb closed vbn,1
will be completed,will md be vb completed vbn,1
will be created,will md be vb created vbn,1
will be done,will md be vb done vbn,1
will be expensed,will md be vb expensed vbn,1
will be lowered,will md be vb lowered vbn,1
will be made,will md be vb made vbn,1
will be opened,will md be vb opened vbn,1
will be performed,will md be vb performed vbn,1
will be presented,will md be vb presented vbn,1
will be put,will md be vb put vbn,1
will be recommended,will md be vb recommended vbn,1
will be replaced,will md be vb replaced vbn,1
will be required,will md be vb required vbn,1
will be revisited,will md be vb revisited vbn,1
will be scheduled,will md be vb scheduled vbn,1
will be taken,will md be vb taken vbn,1
will be tested,will md be vb tested vbn,1
will be used,will md be vb used vbn,1
winding,winding vbg,1
windings,windings nns,1
windows,windows nns,1
windows on end,windows nns on in_pos end nn,1
wiped,wiped vbd,1
wire,wire nn,1
wired,wired vbd,1
wireline,wireline nn,1
wires,wires nns,1
wiring,wiring nn,1
wirings,wirings nns,1
with ac motor,with in_pos ac jj motor nn,1
with air,with in_pos air nn,1
with antisieze,with in_pos antisieze nn,1
with assembling,with in_pos assembling vbg,1
with bl,with in_pos bl nn,1
with bleed,with in_pos bleed nn,1
with bop test,with in_pos bop jj test nn,1
with brush,with in_pos brush nn,1
with c,with in_pos c nns,1
with clamp,with in_pos clamp nn,1
with closed loop,with in_pos closed jj loop nn,1
with day,with in_pos day nn,1
with deflection,with in_pos deflection nn,1
with dirt,with in_pos dirt nn,1
with drill,with in_pos drill nn,1
with driller,with in_pos driller nn,1
with drilling,with in_pos drilling nn,1
with dry air,with in_pos dry jj air nn,1
with earth bond,with in_pos earth jj bond nn,1
with electrical supervisor,with in_pos electrical jj supervisor nn,1
with engineering,with in_pos engineering nn,1
with extech ir,with in_pos extech jj ir nn,1
with eye,with in_pos eye nn,1
with function,with in_pos function nn,1
with good ir,with in_pos good jj ir nn,1
with good operating,with in_pos good jj operating nn,1
with grease,with in_pos grease nn,1
with halliburton,with in_pos halliburton nn,1
with heater,with in_pos heater nn,1
with help,with in_pos help nn,1
with hp,with in_pos hp nn,1
with ibop,with in_pos ibop nn,1
with interlock,with in_pos interlock nn,1
with ir gun,with in_pos ir jj gun nn,1
with iso motor,with in_pos iso jj motor nn,1
with itthis,with in_pos itthis nn,1
with jbox,with in_pos jbox nn,1
with lead,with in_pos lead nn,1
with loss,with in_pos loss nn,1
with low air,with in_pos low jj air nn,1
with lucas,with in_pos lucas nn,1
with maintenance,with in_pos maintenance nn,1
with manual probe,with in_pos manual jj probe nn,1
